{
  "schema_version": "live-action-coverage-spec-v1",
  "coverage_id": "sts2-v0.107.1-defect-a0-live-coverage-v1",
  "ruleset_manifest_id": "sha256:cd469f5218ffab6d979f5eb43233e90fbe3d81919f6c21169b57a95cbe69a6bd",
  "scope": {
    "character": "The Defect",
    "difficulty": {
      "mode": "standard",
      "ascension": 0
    }
  },
  "required_state_types": [
    "boss",
    "bundle_select",
    "card_reward",
    "card_select",
    "crystal_sphere",
    "elite",
    "event",
    "fake_merchant",
    "game_over",
    "hand_select",
    "map",
    "menu",
    "monster",
    "relic_select",
    "rest_site",
    "rewards",
    "shop",
    "treasure"
  ],
  "required_decision_types": [
    "card_selection",
    "combat",
    "combat_selection",
    "event",
    "menu",
    "mini_game",
    "path",
    "relic_selection",
    "rest_site",
    "reward",
    "shop",
    "terminal",
    "treasure"
  ],
  "required_action_kinds": [
    "advance_dialogue",
    "cancel_bundle_selection",
    "cancel_selection",
    "choose_event_option",
    "choose_map_node",
    "choose_rest_option",
    "claim_reward",
    "claim_treasure_relic",
    "combat_confirm_selection",
    "combat_select_card",
    "confirm_bundle_selection",
    "confirm_selection",
    "crystal_sphere_click_cell",
    "crystal_sphere_proceed",
    "crystal_sphere_set_tool",
    "discard_potion",
    "end_turn",
    "menu_select",
    "play_card",
    "proceed",
    "select_bundle",
    "select_card",
    "select_card_reward",
    "select_relic",
    "shop_purchase",
    "skip_card_reward",
    "skip_relic_selection",
    "use_potion"
  ],
  "minimum_terminal_runs": 1
}
